{
    "schemaVersion": "1",
    "source": {
        "name": "UniVRM",
        "version": "v0.131.2",
        "commit": "928b30e96439c1c11a49b172efb72eb96d2cad8b",
        "notes": "Captured from the Unity runtime scene on macOS ARM64."
    },
    "fixture": {
        "path": "Assets/AvatarSample_M.vrm",
        "sha256": "75954b19b6cc148ee4cdba88e9833db0dd321318f85098b834b3de36275b4bb1"
    },
    "coordinateSystem": {
        "handedness": "right",
        "upAxis": "+Y",
        "forwardAxis": "+Z",
        "units": "meters",
        "notes": "Unity world coordinates; rotations are Unity quaternions."
    },
    "tolerances": {
        "translation": 0.0020000000949949028,
        "rotation": 0.0010000000474974514,
        "scalar": 0.0010000000474974514
    },
    "samples": {
        "bones": [
            {
                "time": 0.0,
                "values": {
                    "names": [
                        "Hips",
                        "LeftUpperLeg",
                        "RightUpperLeg",
                        "LeftLowerLeg",
                        "RightLowerLeg",
                        "LeftFoot",
                        "RightFoot",
                        "Spine",
                        "Chest",
                        "Neck",
                        "Head",
                        "LeftShoulder",
                        "RightShoulder",
                        "LeftUpperArm",
                        "RightUpperArm",
                        "LeftLowerArm",
                        "RightLowerArm",
                        "LeftHand",
                        "RightHand",
                        "LeftToes",
                        "RightToes",
                        "LeftEye",
                        "RightEye",
                        "LeftThumbProximal",
                        "LeftThumbIntermediate",
                        "LeftThumbDistal",
                        "LeftIndexProximal",
                        "LeftIndexIntermediate",
                        "LeftIndexDistal",
                        "LeftMiddleProximal",
                        "LeftMiddleIntermediate",
                        "LeftMiddleDistal",
                        "LeftRingProximal",
                        "LeftRingIntermediate",
                        "LeftRingDistal",
                        "LeftLittleProximal",
                        "LeftLittleIntermediate",
                        "LeftLittleDistal",
                        "RightThumbProximal",
                        "RightThumbIntermediate",
                        "RightThumbDistal",
                        "RightIndexProximal",
                        "RightIndexIntermediate",
                        "RightIndexDistal",
                        "RightMiddleProximal",
                        "RightMiddleIntermediate",
                        "RightMiddleDistal",
                        "RightRingProximal",
                        "RightRingIntermediate",
                        "RightRingDistal",
                        "RightLittleProximal",
                        "RightLittleIntermediate",
                        "RightLittleDistal",
                        "UpperChest"
                    ],
                    "types": [],
                    "sources": [],
                    "scalars": [],
                    "positions": [
                        {
                            "x": 0.0,
                            "y": 0.7576853632926941,
                            "z": 0.003810133319348097
                        },
                        {
                            "x": -0.0704415813088417,
                            "y": 0.7216354012489319,
                            "z": 0.0005060369148850441
                        },
                        {
                            "x": 0.0704415813088417,
                            "y": 0.7216354012489319,
                            "z": 0.0005060369148850441
                        },
                        {
                            "x": -0.07044156640768051,
                            "y": 0.4303874373435974,
                            "z": -0.005588908214122057
                        },
                        {
                            "x": 0.07044156640768051,
                            "y": 0.4303874373435974,
                            "z": -0.005588908214122057
                        },
                        {
                            "x": -0.07044156640768051,
                            "y": 0.08535408973693848,
                            "z": -0.02657494693994522
                        },
                        {
                            "x": 0.07044156640768051,
                            "y": 0.08535408973693848,
                            "z": -0.02657494693994522
                        },
                        {
                            "x": 5.845327273341027e-32,
                            "y": 0.8041406869888306,
                            "z": 0.015106672421097756
                        },
                        {
                            "x": -1.9799062615463025e-17,
                            "y": 0.9036961197853088,
                            "z": 0.017324669286608697
                        },
                        {
                            "x": 9.846644191778954e-17,
                            "y": 1.1220831871032715,
                            "z": -0.031006742268800737
                        },
                        {
                            "x": -1.4773517131860815e-10,
                            "y": 1.1792173385620118,
                            "z": -0.02380697801709175
                        },
                        {
                            "x": -0.02044639177620411,
                            "y": 1.0977709293365479,
                            "z": -0.023341331630945207
                        },
                        {
                            "x": 0.02044639177620411,
                            "y": 1.0977709293365479,
                            "z": -0.023341331630945207
                        },
                        {
                            "x": -0.09357699751853943,
                            "y": 1.0873539447784424,
                            "z": -0.023341268301010133
                        },
                        {
                            "x": 0.09357699751853943,
                            "y": 1.0873539447784424,
                            "z": -0.023341268301010133
                        },
                        {
                            "x": -0.2845059931278229,
                            "y": 1.0873539447784424,
                            "z": -0.023341264575719835
                        },
                        {
                            "x": 0.2845059931278229,
                            "y": 1.0873539447784424,
                            "z": -0.023341264575719835
                        },
                        {
                            "x": -0.46918749809265139,
                            "y": 1.0873562097549439,
                            "z": -0.023329801857471467
                        },
                        {
                            "x": 0.46918749809265139,
                            "y": 1.0873562097549439,
                            "z": -0.023329801857471467
                        },
                        {
                            "x": -0.07044156640768051,
                            "y": 0.03945821523666382,
                            "z": 0.05399119481444359
                        },
                        {
                            "x": 0.07044156640768051,
                            "y": 0.03945821523666382,
                            "z": 0.05399119481444359
                        },
                        {
                            "x": -0.013359913602471352,
                            "y": 1.2342658042907715,
                            "z": -0.0052421544678509239
                        },
                        {
                            "x": 0.01335990708321333,
                            "y": 1.2342658042907715,
                            "z": -0.005242135841399431
                        },
                        {
                            "x": -0.47210997343063357,
                            "y": 1.079047441482544,
                            "z": -0.010077446699142456
                        },
                        {
                            "x": -0.5014460682868958,
                            "y": 1.077335000038147,
                            "z": 0.015045687556266785
                        },
                        {
                            "x": -0.5201584696769714,
                            "y": 1.0765297412872315,
                            "z": 0.029698237776756288
                        },
                        {
                            "x": -0.5234929323196411,
                            "y": 1.0934830904006959,
                            "z": -0.00701130973175168
                        },
                        {
                            "x": -0.5510778427124023,
                            "y": 1.0934829711914063,
                            "z": -0.007547762710601091
                        },
                        {
                            "x": -0.5680448412895203,
                            "y": 1.0929920673370362,
                            "z": -0.008202727884054184
                        },
                        {
                            "x": -0.5242327451705933,
                            "y": 1.0934832096099854,
                            "z": -0.021630454808473588
                        },
                        {
                            "x": -0.5549647212028503,
                            "y": 1.0934829711914063,
                            "z": -0.021630462259054185